{
  "$schema": "https://srs.semanticops.com/schema/2.0/type.json",
  "id": "e53dce11-6b83-5714-a8fe-f730edb500fa",
  "namespace": "governance",
  "name": "role",
  "version": 1,
  "description": "An authority boundary. Defines who may decide or act on what, without requiring group agreement. Roles are written by the clerk; they are not extracted from transcripts.",
  "semanticObjectType": "role",
  "aiGuidance": {
    "purpose": "Capture a named authority boundary — who holds it, what they may decide alone, and where their authority ends.",
    "negativeGuidance": "A Role is not a job description. It defines decision rights, not responsibilities or duties."
  },
  "fields": [
    { "fieldId": "d7e82557-9045-5e92-a494-d99112bbec4a", "order": 0, "required": true,  "displayLabel": "Role title" },
    { "fieldId": "a6c19b95-4f8f-5b07-93f8-3426c545277e", "order": 1, "required": false, "displayLabel": "Role holder" },
    { "fieldId": "d25da548-79d6-555b-8878-f40b685b3955", "order": 2, "required": true,  "displayLabel": "Authority" },
    { "fieldId": "3c39ee1f-6fe0-5da7-a0b6-928aa3a63211", "order": 3, "required": true,  "displayLabel": "Boundary" },
    { "fieldId": "9a32dc01-f348-5e05-9f54-bb6d21239f04", "order": 4, "required": false, "displayLabel": "Source of authority" },
    { "fieldId": "aee7afe9-6650-5fa4-a61a-495c3b88994b", "order": 5, "required": true,  "displayLabel": "Status" },
    { "fieldId": "c04b7f84-9a55-5353-8c9f-2b62f6a1e34e", "order": 6, "required": false, "displayLabel": "Revisit when" }
  ],
  "tags": ["governance", "role", "authority"],
  "createdAt": "2026-05-26T00:00:00Z"
}
